<?xml version="1.0" encoding="UTF-8"?>
<!-- edited with XMLSpy v2005 U (http://www.xmlspy.com) by sven wyns (home) -->
<xs:schema xmlns:xs="http://www.w3.org/2001/XMLSchema" elementFormDefault="qualified" attributeFormDefault="unqualified">
	<xs:element name="taalvragen">
		<xs:annotation>
			<xs:documentation>xml schema dat de 0, 1 of meerdere taalvragen bevat</xs:documentation>
		</xs:annotation>
		<xs:complexType>
			<xs:sequence minOccurs="0" maxOccurs="unbounded">
				<xs:element name="taalvraag">
					<xs:annotation>
						<xs:documentation>Comment describing your root element</xs:documentation>
					</xs:annotation>
					<xs:complexType>
						<xs:sequence>
							<xs:element name="id">
								<xs:simpleType>
									<xs:restriction base="xs:string">
										<xs:minLength value="1"/>
										<xs:maxLength value="150"/>
									</xs:restriction>
								</xs:simpleType>
							</xs:element>
							<xs:element name="binnengekomen" type="xs:date"/>
							<xs:element name="voornaam" minOccurs="0">
								<xs:simpleType>
									<xs:restriction base="xs:string">
										<xs:maxLength value="50"/>
									</xs:restriction>
								</xs:simpleType>
							</xs:element>
							<xs:element name="naam">
								<xs:simpleType>
									<xs:restriction base="xs:string">
										<xs:minLength value="1"/>
										<xs:maxLength value="50"/>
									</xs:restriction>
								</xs:simpleType>
							</xs:element>
							<xs:element name="organisatie" minOccurs="0">
								<xs:simpleType>
									<xs:restriction base="xs:string">
										<xs:maxLength value="50"/>
									</xs:restriction>
								</xs:simpleType>
							</xs:element>
							<xs:element name="e-mail">
								<xs:simpleType>
									<xs:restriction base="xs:string">
										<xs:minLength value="1"/>
										<xs:maxLength value="255"/>
									</xs:restriction>
								</xs:simpleType>
							</xs:element>
							<xs:element name="fax" minOccurs="0">
								<xs:simpleType>
									<xs:restriction base="xs:string">
										<xs:maxLength value="20"/>
									</xs:restriction>
								</xs:simpleType>
							</xs:element>
							<xs:element name="telefoon" minOccurs="0">
								<xs:simpleType>
									<xs:restriction base="xs:string">
										<xs:maxLength value="25"/>
									</xs:restriction>
								</xs:simpleType>
							</xs:element>
							<xs:element name="vraag">
								<xs:simpleType>
									<xs:restriction base="xs:string">
										<xs:minLength value="1"/>
										<xs:maxLength value="4096"/>
									</xs:restriction>
								</xs:simpleType>
							</xs:element>
						</xs:sequence>
					</xs:complexType>
				</xs:element>
			</xs:sequence>
		</xs:complexType>
	</xs:element>
</xs:schema>
