<?xml version="1.0" encoding="UTF-8"?>
<!--Sample XML file generated by XMLSpy v2005 U (http://www.xmlspy.com)-->
<taalvragen xmlns:xsi="http://www.w3.org/2001/XMLSchema-instance" xsi:noNamespaceSchemaLocation="taalvragen.xsd">
	<taalvraag>
		<id>10975</id>
		<binnengekomen>2004-11-30</binnengekomen>
		<voornaam>Bult√©</voornaam>
		<naam>Roger</naam>
		<organisatie>School DEN TOP St-Pieters-Leeuw</organisatie>
		<e-mail>taaltelefoon@vlaanderen.be</e-mail>
		<fax/>
		<telefoon/>
		<vraag>Wat is de juiste betekenis van ex-libris>? Waar komt dat voor? De uitleg in Van Dale geeft nog geen duidelijk antwoord .</vraag>
	</taalvraag>
</taalvragen>
